{
  "summary": {
    "pendingApprovals": 8,
    "approvalQueues": 6,
    "requiresSupervisor": 5,
    "requiresAdmin": 3
  },
  "queues": [
    {
      "name": "Leave Requests",
      "pending": 3,
      "route": "Employee \u2192 Supervisor \u2192 Admin if override required",
      "permission": "Supervisor may approve supervised employees"
    },
    {
      "name": "Shift Trades",
      "pending": 2,
      "route": "Employee acceptance \u2192 Affected supervisor review(s) \u2192 Schedule update",
      "permission": "Each affected employee supervisor approves their employee; scheduling/admin authority may approve both sides"
    },
    {
      "name": "Open Shift / VOT",
      "pending": 1,
      "route": "Volunteer \u2192 Eligibility check \u2192 Award approval",
      "permission": "Scheduling coordinator or supervisor with open shift approval"
    },
    {
      "name": "Profile Changes",
      "pending": 1,
      "route": "Employee change request \u2192 Admin review when field policy requires approval",
      "permission": "Admin or delegated HR role"
    },
    {
      "name": "Training Requests",
      "pending": 1,
      "route": "Employee/supervisor request \u2192 Training officer or admin",
      "permission": "Training officer, supervisor, or admin by agency policy"
    },
    {
      "name": "Benefit Adjustments",
      "pending": 0,
      "route": "Supervisor request \u2192 Admin/payroll approval",
      "permission": "Admin or payroll role only"
    }
  ],
  "requests": [
    {
      "id": "REQ-2026-0613-001",
      "type": "Vacation",
      "employee": "Morgan Price",
      "submitted": "2026-06-13 08:12",
      "hours": "8.0",
      "status": "Pending Supervisor",
      "currentStep": "Supervisor Review",
      "coverage": "At minimum after approval",
      "eligibility": "Allowed",
      "recommendation": "Approve if coverage remains stable",
      "reason": "Family event"
    },
    {
      "id": "TRD-2026-0613-004",
      "type": "Shift Trade",
      "employee": "Taylor Reed \u2192 Jordan Ellis",
      "submitted": "2026-06-13 09:40",
      "hours": "12.0",
      "status": "Pending Acceptance",
      "currentStep": "Other Employee Acceptance",
      "coverage": "Stable",
      "eligibility": "Qualification match",
      "recommendation": "Hold until accepting employee confirms",
      "reason": "Personal appointment"
    },
    {
      "id": "VOT-2026-0613-002",
      "type": "Voluntary Overtime",
      "employee": "Alex Carter",
      "submitted": "2026-06-13 11:05",
      "hours": "4.0",
      "status": "Pending Award",
      "currentStep": "Award Review",
      "coverage": "Fills open dispatcher slot",
      "eligibility": "Eligible",
      "recommendation": "Approve/award",
      "reason": "Available for callback"
    },
    {
      "id": "PRO-2026-0613-009",
      "type": "Profile Change",
      "employee": "Casey Turner",
      "submitted": "2026-06-13 12:25",
      "hours": "\u2014",
      "status": "Pending Admin",
      "currentStep": "Admin Field Approval",
      "coverage": "No impact",
      "eligibility": "Field requires approval",
      "recommendation": "Approve if verified",
      "reason": "Updated personal cell number"
    }
  ],
  "chains": [
    {
      "workflow": "Standard Leave",
      "steps": [
        "Submit",
        "Supervisor Review",
        "Coverage Check",
        "Approve/Deny",
        "Audit"
      ]
    },
    {
      "workflow": "Trade / Swap",
      "steps": [
        "Submit",
        "Employee Acceptance",
        "Eligibility Check",
        "Supervisor A Review",
        "Supervisor B Review or Scheduling/Admin Override",
        "Audit"
      ]
    },
    {
      "workflow": "Profile Change",
      "steps": [
        "Edit Request",
        "Field Policy Check",
        "Admin Review if Required",
        "Apply Change",
        "Audit"
      ]
    },
    {
      "workflow": "Benefit Adjustment",
      "steps": [
        "Adjustment Request",
        "Permission Check",
        "Admin/Payroll Approval",
        "Ledger Update",
        "Audit"
      ]
    }
  ],
  "policyChecks": [
    "Approval authority uses the Roles & Permissions Engine and supervisor hierarchy scope.",
    "Shift trades across supervisor groups require each affected supervisor to approve, unless scheduling/admin authority approves both sides.",
    "Every approval, denial, escalation, and override writes an audit event.",
    "Requests that fail coverage, eligibility, benefit, or field-policy checks require escalation or override reason.",
    "Final schedule/database writes remain disabled in this prototype until backend actions are connected."
  ]
}